id,url,region,region_url,price,type,sqfeet,beds,baths,cats_allowed,dogs_allowed,smoking_allowed,wheelchair_access,electric_vehicle_charge,comes_furnished,laundry_options,parking_options,image_url,description,lat,long,state
7049044568,https://reno.craigslist.org/apa/d/reno-beautiful-3x2-newly-renovated/7049044568.html,reno / tahoe,https://reno.craigslist.org,1148,apartment,1078,3,2,1,1,0,0,0,0,w/d in unit,carport,https://images.craigslist.org/01616_daghmBUvTCI_600x450.jpg,"Ridgeview by Vintage is where you will find all of your apartment living needs at a price you can afford!  Our spacious homes are located just off the freeway for easy access to shopping and entertainment, as well as a short drive from all the wonderful outdoor activities that the Truckee Meadows has to offer! Newly renovated homes and we have BRAND-NEW APPLIANCES! Some of the apartment features include; large windows for natural sunlight, central air conditioning and heating, plenty of cabinet space Personal Storage space near your home, Walk in closets, Patios/Balconies Appliances included; stove, microwave, dishwasher, refrigerator, washer and dryer  Our community features a sparkling seasonal pool, fitness center, basketball court, picnic areas with barbecues for your convenience, 2 playgrounds, after hours patrol, covered carport for every home and plenty of guest parking.  We have 24-hour emergency maintenance  *Non-Smoking Community* *INCOME RESTRICTIONS APPLY*  Call us to find out more today. Hurry our homes are going fast!  Hablmos Espanol!  ADDRESS: 4050 Gardella Ave, Reno NV 89512 Phone:  show contact info  OFFICE HOURS:",39.5483,-119.796,ca
7049047186,https://reno.craigslist.org/apa/d/reno-reduced-lovely-2bd-2ba-condo/7049047186.html,reno / tahoe,https://reno.craigslist.org,1200,condo,1001,2,2,0,0,0,0,0,0,w/d hookups,carport,https://images.craigslist.org/00V0V_5va0MkgO9qu_600x450.jpg,"Conveniently located in the middle town of Reno. Close to Highway, 10 mins to UNR, shopping and restaurants. Lovely 2 bedroom/2 full bathroom with walk-in closet. Central AC.  Available Jan. Now. Please call  show contact info  for viewing.",39.5026,-119.789,ca
7043634882,https://reno.craigslist.org/apa/d/sparks-state-of-the-art-fitness-center/7043634882.html,reno / tahoe,https://reno.craigslist.org,1813,apartment,1683,2,2,1,1,1,0,0,0,w/d in unit,attached garage,https://images.craigslist.org/00t0t_erYqC6LgB8r_600x450.jpg,"2BD | 2BA | 1683SQFTDiscover exceptional service and well-designed spacious floor plans at Caviata apartment homes in Sparks, Nevada. Our Kiley Ranch and Spanish Springs neighborhood pet friendly two and three-bedroom apartment homes feature fully equipped kitchens with expansive granite countertops and kitchen pantries. Youâll love the direct access garages, oversized windows, gas fireplace with mantle, and ample closet space. (+more) As a resident of Caviata at Kiley Ranch, youâll enjoy many resort-style amenities, such as a state-of-the-art fitness center, sparkling pool, and spa. Picture yourself at the BBQ on a beautiful day with your friends and family. Enjoy the great outdoors with miles of jogging and biking paths nearby. Caviata at Kiley Ranch is conveniently located by the Links at Kiley Ranch Golf Course, minutes from Pyramid Lake Highway. The Outlets at Legends and many restaurants and entertainment venues are just down the street, and weâre located conveniently to Reno and major employers such as Tesla, Google, Amazon, and Panasonic. Come home to Caviata at Kiley Ranch apartment homesâ¦. Youâll love living here! Please check out our photo gallery and call for an appointment today.Amenities Include:Pre-Wired for InternetExtra Storage SpaceControlled AccessWasher/DryerSpacious Attached GaragesBBQ/Picnic AreaPersonalized Resident ServicesPatio or BalconyOn-site Maintenance and ManagementShort Term LeaseLarge Kitchen PantryStunning Sun DeckCall:  show contact info Equal Housing OpportunityPrices Change DailyFlexible Lease Terms",39.6269,-119.708,ca
7049045324,https://reno.craigslist.org/apa/d/reno-1x1-first-floor-washer-dryer-no/7049045324.html,reno / tahoe,https://reno.craigslist.org,1095,apartment,708,1,1,1,1,1,0,0,0,w/d in unit,carport,https://images.craigslist.org/00303_3HSJz75zlIf_600x450.jpg,"MOVE IN SPECIAL FREE WASHER/DRYER WITH 6 OR 12 MONTH LEASE! *Ask about our preferred employer program for extra discounts!  One bedroom/One bath 708 sq.ft. $1095 per month Deposit $400 1/2 refundable *Specials and rates are subject to change at any time  -Call us today at  show contact info  or  show contact info  Visit us on our website: enclavereno.com Office hours: Monday-Saturday 9-6pm & Sunday's 11-5pm  Unit Features Â· Full size washer and dryer available Â· Spacious Private patio/balcony -Â· Frost free refrigerator Â· Oven and Dishwasher Â· Brushed stainless steel kitchen sinks Â· Central heating/air conditioning Â· Pre wired for multiple phones & cable Â· Spacious walk in closets Â· Stylish interior colors Â· Window coverings throughout Â· Fire sprinkler system  Community Features Gated access entry, Heated seasonal pool, Whirlpool spa open year-round, Club quality fitness center available, Garages with remote openers, Two sizes of storage units, Basketball/sport court, Picnic areas with barbecues, 2 Toddler playgrounds, 2 Clothing care centers, After Hours Courtesy patrol, Designated non-smoking buildings, 24-hour Emergency maintenance, Covered Carport, Fenced in Dog Park and Guest Parking.  If you would like to take a tour of our community please give us a call at  show contact info  OR  show contact info  to schedule an appointment. Our friendly professional office staff will be happy to assist you during our office hours Monday-Saturday 9-6 pm and on Sunday 11-5pm.",39.4477,-119.771,ca
7049043759,https://reno.craigslist.org/apa/d/reno-no-long-term-lease-required/7049043759.html,reno / tahoe,https://reno.craigslist.org,289,apartment,250,0,1,1,1,1,1,0,1,laundry on site,,https://images.craigslist.org/01616_fALAWFV8zQN_600x450.jpg,"Move In Today: Reno Low-Cost, Clean & Furnished Apartments close to Restaurants, Cafes, Parks, and More!  Call Us! Move In Today! Available:Studio Units **Short Term Flexible Options **Utilities Included**Fully Furnished **Free Basic Cable TV Call Now: show contact info  Additional Information:www.siegelsuites.com Siegel Suites 701 E 7th street Reno NV 89512  Apartment Home Features  - Sparkling Pool - Pet/Dog Friendly -kitchenettes an full bath - Easy access to I-80  - Close to Riverwalk, downtown, an parks  -  Free Siegel Reward Program Earn points every time you pay your rent or refer a friend. Use your points to treat yourself to free rent, food, movies, gift cards, and much more!.",39.5357,-119.805,ca
7046327064,https://reno.craigslist.org/apa/d/reno-walk-in-closet-extra-storage/7046327064.html,reno / tahoe,https://reno.craigslist.org,1093,apartment,720,1,1,1,1,1,0,0,0,laundry in bldg,,https://images.craigslist.org/00808_1EfWoZv4NXC_600x450.jpg,"1BD | 1BA | 720SQFTIn addition to attractive, comfortable apartments, Village at Iron Blossom combines all that Reno has to offer in one well-rounded community. We feature spacious one, two, and three bedroom oversized apartment homes where you'll find the style that matches the look and life you desire. (+more) Take advantage of endless workout options in our state of the art 24-hour fitness center including a yoga studio, indoor racquetball court, weight training equipment, cardio machines, and a private tanning room. Our social community offers the Instagram-worthy gathering areas you crave with the resort-style feel you deserve. Our four swimming pools and two indoor spas offer a stunning backdrop to the lifestyle we want for our residents: Cool, fun, vibrant, and bold! Our apartments are spacious, yet cozy; eye-catching, but comfortable. Find your ideal home for rent in Reno, NV, where the perfect setting for your next party is combined with a relaxing space for your everyday. You will enjoy features like energy efficient appliances, wood burning fireplaces and triple pane energy efficient windows to bring quality to your everyday life. Step inside Village at Iron Blossom, tucked just off Interstate 580 in growing South Reno, to get an idea of living in our pet-friendly apartment community. When living in the beautiful South Reno, the hardest decision you'll make is where to enjoy on your day off. With an abundance recreation offered at nearby Lake Tahoe and the Truckee River. Enjoy being minutes from all that's possible in Reno, such as an Aces Baseball game but also conveniently close to Renown Hospital Medical Center, and less than 15 miles from UNR. Take a look at our photogallery and schedule your appointment, or drop by and visit us for your personal tour today. Spacious Reno, Nevada ApartmentsAmenities Include:Pet Friendly Paw ParksTennis & Basketball CourtsFurnished Homes AvailablePicnic and BBQ Areas with Horse-Shoe pitsEnergy Efficient AppliancesViewWalk-in ClosetsAir ConditioningDisposalOnline Resident Portal for rental payments and maintenance requests,Tanning BedBeautiful Mountain ViewsCall:  show contact info Equal Housing OpportunityPrices Change DailyFlexible Lease Terms",39.4572,-119.776,ca
7049020738,https://reno.craigslist.org/apa/d/1-bedroom-available-in-midtown/7049020738.html,reno / tahoe,https://reno.craigslist.org,935,apartment,661,1,1,1,1,1,0,0,0,laundry on site,off-street parking,https://images.craigslist.org/00C0C_i1DJWxfSZC6_600x450.jpg,"Tucked away in a park-like setting on the edge of midtown, located just minutes from shopping, restaurants. Charming updated Apartment with Free wifi, on sight laundry, assigned  parking and off street parking. Pets are always welcome up to 25 lbs. The unit coming available is located on the 2nd floor. Carpet through out.  Security deposit is $500 - Credit Check $25 per applicant - Pet Fee (half refundable) $300   Please schedule an appointment today, by calling Juliet at  show contact info .  Royal Oak Apartments 355 Broadway Blvd Reno, NV 89502",39.5118,-119.802,ca
7049041899,https://reno.craigslist.org/apa/d/reno-1x1-first-floor-washer-dryer-no/7049041899.html,reno / tahoe,https://reno.craigslist.org,1095,apartment,708,1,1,1,1,1,0,0,0,w/d in unit,carport,https://images.craigslist.org/00303_3HSJz75zlIf_600x450.jpg,"MOVE IN SPECIAL FREE WASHER/DRYER WITH 6 OR 12 MONTH LEASE! *Ask about our preferred employer program for extra discounts!  One bedroom/One bath 708 sq.ft. $1095 per month Deposit $400 1/2 refundable *Specials and rates are subject to change at any time  -Call us today at  show contact info  or  show contact info  Visit us on our website: enclavereno.com Office hours: Monday-Saturday 9-6pm & Sunday's 11-5pm  Unit Features Â· Full size washer and dryer available Â· Spacious Private patio/balcony -Â· Frost free refrigerator Â· Oven and Dishwasher Â· Brushed stainless steel kitchen sinks Â· Central heating/air conditioning Â· Pre wired for multiple phones & cable Â· Spacious walk in closets Â· Stylish interior colors Â· Window coverings throughout Â· Fire sprinkler system  Community Features Gated access entry, Heated seasonal pool, Whirlpool spa open year-round, Club quality fitness center available, Garages with remote openers, Two sizes of storage units, Basketball/sport court, Picnic areas with barbecues, 2 Toddler playgrounds, 2 Clothing care centers, After Hours Courtesy patrol, Designated non-smoking buildings, 24-hour Emergency maintenance, Covered Carport, Fenced in Dog Park and Guest Parking.  If you would like to take a tour of our community please give us a call at  show contact info  OR  show contact info  to schedule an appointment. Our friendly professional office staff will be happy to assist you during our office hours Monday-Saturday 9-6 pm and on Sunday 11-5pm.",39.4477,-119.771,ca